{
  "event_id": "1c2d3e4f-5a6b-4c7d-8e9f-0a1b2c3d4e5f",
  "event_type": "analysis.preliminary_ready",
  "event_version": "1.0",
  "occurred_at": "2026-07-06T09:46:00Z",
  "data": {
    "analysis_result_id": "b2c3d4e5-f6a7-4182-93a4-b5c6d7e8f9a0",
    "mission_id": "c3d4e5f6-a7b8-4293-a4b5-c6d7e8f9a0b1",
    "field_id": "d4e5f6a7-b8c9-43a4-b5c6-d7e8f9a0b1c2",
    "dataset_id": "f6a7b8c9-d0e1-45c6-d7e8-f9a0b1c2d3e4",
    "report_phase": "PRELIMINARY",
    "report_tier": "TEMEL"
  },
  "metadata": {
    "correlation_id": "corr_mission_123",
    "causation_id": "7a8b9c0d-1e2f-4031-8243-5a6b7c8d9e0f",
    "source_service": "platform-worker-bridge"
  }
}
